[
  {
    "id": "intro_home_island",
    "title": "Choose your home island",
    "text": "Welcome to the Old Coast, governor. Your sloop carries the company's planks and sails, and its gold is yours to spend. Every island is open to you: look at their fertilities and deposits, sail to the one you want as your home and found a Trading Post there. Its pier stands on the water; it stores the island's goods and receives your ships.",
    "objectives": [
      { "kind": "island_settled", "count": 1 }
    ],
    "rewards": { "gold": 25 },
    "prerequisites": []
  },
  {
    "id": "intro_first_road",
    "title": "Roads from the Trading Post",
    "text": "Nothing reaches the Trading Post without a road: lay ten tiles of dirt road leading away from it. Roads cost nothing, and every building they connect delivers to the Trading Post or a Warehouse.",
    "objectives": [
      { "kind": "building_count", "type": "road_dirt", "min": 10 }
    ],
    "rewards": { "gold": 25 },
    "prerequisites": ["intro_home_island"]
  },
  {
    "id": "intro_planks",
    "title": "Timber for the colony",
    "text": "Every house and workshop needs planks. Build a lumberjack in the forest and a sawmill, and connect both to the Trading Post by road. The company sends planks to get you started. Goods beyond the Trading Post capacity of the island you choose are lost.",
    "objectives": [
      { "kind": "connected", "type": "lumberjack" },
      { "kind": "connected", "type": "sawmill" }
    ],
    "rewards": { "goods": { "planks": 45 } },
    "prerequisites": ["intro_first_road"]
  },
  {
    "id": "intro_houses",
    "title": "Room for settlers",
    "text": "Settlers pay taxes, and they are the workers of your workshops. Build four settler houses along the road.",
    "objectives": [
      { "kind": "building_count", "type": "house_settlers", "min": 4 }
    ],
    "rewards": { "gold": 25 },
    "prerequisites": ["intro_planks"]
  },
  {
    "id": "intro_fish",
    "title": "Fish for the table",
    "text": "Hungry settlers neither grow nor pay their full taxes. Build a fisher with its jetty on the water and connect it to the Trading Post. Here are more planks for houses. Goods beyond the Trading Post capacity of the island you choose are lost.",
    "objectives": [
      { "kind": "connected", "type": "fisher" }
    ],
    "rewards": { "goods": { "planks": 45 } },
    "prerequisites": ["intro_houses"]
  },
  {
    "id": "intro_market",
    "title": "A market square",
    "text": "Settlers want a market within reach of their houses. Build a small market and connect it to the road.",
    "objectives": [
      { "kind": "connected", "type": "market" }
    ],
    "rewards": { "gold": 25 },
    "prerequisites": ["intro_fish"]
  },
  {
    "id": "intro_wool",
    "title": "Warm clothes",
    "text": "Well-dressed settlers are content, and content settlers become citizens one day. Build a sheep farm and a wool weaver and connect both to the Trading Post.",
    "objectives": [
      { "kind": "connected", "type": "sheep_farm" },
      { "kind": "connected", "type": "weaver_wool" }
    ],
    "rewards": { "gold": 50 },
    "prerequisites": ["intro_market"]
  },
  {
    "id": "intro_chapel",
    "title": "A place of worship",
    "text": "Citizens will only settle in a town with a chapel. Build one and connect it to the road.",
    "objectives": [
      { "kind": "connected", "type": "chapel" }
    ],
    "rewards": { "gold": 50 },
    "prerequisites": ["intro_wool"]
  },
  {
    "id": "intro_settlers_120",
    "title": "A growing town",
    "text": "Fed and housed settlers move in on their own. Grow the archipelago to 120 settlers: with a market and a chapel, citizens may then arrive. These planks are for more houses. Goods beyond the Trading Post capacity of the island you choose are lost.",
    "objectives": [
      { "kind": "population", "tier": "settlers", "min": 120 }
    ],
    "rewards": { "goods": { "planks": 30 } },
    "prerequisites": ["intro_chapel"]
  },
  {
    "id": "intro_island2",
    "title": "A second settlement",
    "text": "Beyond the bay lies a second island with iron in its hills. Load your sloop with planks for a Trading Post and sail there to found a settlement. Here are planks for its first buildings. Goods beyond the Trading Post capacity of the island you choose are lost.",
    "objectives": [
      { "kind": "island_settled", "count": 2 }
    ],
    "rewards": { "goods": { "planks": 30 } },
    "prerequisites": ["intro_settlers_120"]
  },
  {
    "id": "intro_tools",
    "title": "Tools from the second island",
    "text": "Citizens' workshops need tools. Mine iron, smelt it and make tools where the iron is, and let a sloop on a route bring them home: store ten tools in a Trading Post.",
    "objectives": [
      { "kind": "route_exists" },
      { "kind": "stock", "good": "tools", "min": 10 }
    ],
    "rewards": { "gold": 100 },
    "prerequisites": ["intro_island2"]
  },
  {
    "id": "intro_citizen_house",
    "title": "The first citizens",
    "text": "Upgrade a full settler house whose needs are all met into a citizen house. Its walls need stone: quarry it on an island with stone deposits.",
    "objectives": [
      { "kind": "building_count", "type": "house_citizens", "min": 1 }
    ],
    "rewards": { "gold": 100 },
    "prerequisites": ["intro_tools"]
  },
  {
    "id": "citizens_shipyard",
    "title": "A shipyard of our own",
    "text": "Citizens open the way to shipbuilding. Build a shipyard with its slipway in the water: the company sends the sails for your first new sloop. Goods beyond the Trading Post capacity of the island you choose are lost.",
    "objectives": [
      { "kind": "tier_unlocked", "tier": "citizens" },
      { "kind": "building_count", "type": "shipyard", "min": 1 }
    ],
    "rewards": { "goods": { "sails": 10 } },
    "prerequisites": ["intro_settlers_120"]
  },
  {
    "id": "citizens_sloop",
    "title": "A second sloop",
    "text": "One sloop cannot sail a route and found islands at once. Order a sloop at the shipyard.",
    "objectives": [
      { "kind": "ship_count", "min": 2 }
    ],
    "rewards": { "gold": 50 },
    "prerequisites": ["citizens_shipyard"]
  },
  {
    "id": "citizens_tavern",
    "title": "A tavern for the town",
    "text": "Citizens want a tavern, a market and a chapel within reach. Build a tavern and connect it to the road.",
    "objectives": [
      { "kind": "connected", "type": "tavern" }
    ],
    "rewards": { "gold": 50 },
    "prerequisites": ["citizens_sloop"]
  },
  {
    "id": "citizens_school",
    "title": "Letters and numbers",
    "text": "A school serves the citizens around it like the tavern does: each service in reach adds to their contentment. Build a school and connect it to the road.",
    "objectives": [
      { "kind": "connected", "type": "school" }
    ],
    "rewards": { "gold": 100 },
    "prerequisites": ["citizens_tavern"]
  },
  {
    "id": "citizens_cheese",
    "title": "Cheese for the table",
    "text": "Citizens eat bread or cheese, and both together feed them best. Build a dairy farm with its pastures and a cheese dairy, and connect both to the Trading Post.",
    "objectives": [
      { "kind": "connected", "type": "dairy_farm" },
      { "kind": "connected", "type": "cheese_dairy" }
    ],
    "rewards": { "gold": 100 },
    "prerequisites": ["citizens_school"]
  }
]
